root@comp3134host:~# tcpdump -c 5 -i eth0
tcpdump: verbose output suppressed, use -v or -vv for full protocol decode
listening on eth0, link-type EN10MB (Ethernet), capture size 262144 bytes
18:10:35.361348 IP comp3134host.ssh > 198.96.84.204.16661: Flags [P.], seq 1469638120:1469638228, ack 1274360101, win 501, length 108
18:10:35.361444 IP comp3134host.ssh > 198.96.84.204.16661: Flags [P.], seq 108:136, ack 1, win 501, length 28
18:10:35.361650 IP comp3134host.ssh > 198.96.84.204.16661: Flags [P.], seq 136:244, ack 1, win 501, length 108
18:10:35.361733 IP comp3134host.ssh > 198.96.84.204.16661: Flags [P.], seq 244:272, ack 1, win 501, length 28
18:10:35.362709 IP comp3134host.46929 > 67.207.67.3.domain: 49004+ [1au] PTR? 204.84.96.198.in-addr.arpa. (55)
5 packets captured
32 packets received by filter
21 packets dropped by kernel
