root@comp3134host:~# tcpdump -r 0001.pcap
reading from file 0001.pcap, link-type EN10MB (Ethernet)
18:26:06.548576 IP comp3134host.ssh > 198.96.84.204.16661: Flags [P.], seq 1475506076:1475506120, ack 1274371993, win 501, length 44
18:26:06.548705 IP comp3134host.ssh > 198.96.84.204.16661: Flags [P.], seq 44:152, ack 1, win 501, length 108
18:26:06.548792 IP comp3134host.ssh > 198.96.84.204.16661: Flags [P.], seq 152:180, ack 1, win 501, length 28
18:26:06.551036 IP 198.96.84.204.16661 > comp3134host.ssh: Flags [.], ack 44, win 512, length 0
18:26:06.552214 IP 198.96.84.204.16661 > comp3134host.ssh: Flags [.], ack 180, win 511, length 0
root@comp3134host:~# tcpdump -n -i eth0
tcpdump: verbose output suppressed, use -v or -vv for full protocol decode
listening on eth0, link-type EN10MB (Ethernet), capture size 262144 bytes
18:27:49.814455 IP 165.227.37.161.22 > 198.96.84.204.16661: Flags [P.], seq 1475507712:1475507820, ack 1274372209, win 501, length 108
18:27:49.814577 IP 165.227.37.161.22 > 198.96.84.204.16661: Flags [P.], seq 108:136, ack 1, win 501, length 28
18:27:49.814679 IP 165.227.37.161.22 > 198.96.84.204.16661: Flags [P.], seq 136:244, ack 1, win 501, length 108
18:27:49.814750 IP 165.227.37.161.22 > 198.96.84.204.16661: Flags [P.], seq 244:272, ack 1, win 501, length 28
18:27:49.814978 IP 165.227.37.161.22 > 198.96.84.204.16661: Flags [P.], seq 272:444, ack 1, win 501, length 172
18:27:49.815061 IP 165.227.37.161.22 > 198.96.84.204.16661: Flags [P.], seq 444:472, ack 1, win 501, length 28
18:27:49.815162 IP 165.227.37.161.22 > 198.96.84.204.16661: Flags [P.], seq 472:612, ack 1, win 501, length 140
18:27:49.815234 IP 165.227.37.161.22 > 198.96.84.204.16661: Flags [P.], seq 612:640, ack 1, win 501, length 28
18:27:49.815329 IP 165.227.37.161.22 > 198.96.84.204.16661: Flags [P.], seq 640:780, ack 1, win 501, length 140
18:27:49.816727 IP 198.96.84.204.16661 > 165.227.37.161.22: Flags [.], ack 108, win 511, length 0
18:27:49.816790 IP 165.227.37.161.22 > 198.96.84.204.16661: Flags [P.], seq 780:1816, ack 1, win 501, length 1036
18:27:49.816895 IP 198.96.84.204.16661 > 165.227.37.161.22: Flags [.], ack 444, win 510, length 0
18:27:49.816989 IP 165.227.37.161.22 > 198.96.84.204.16661: Flags [P.], seq 1816:1940, ack 1, win 501, length 124
18:27:49.817078 IP 165.227.37.161.22 > 198.96.84.204.16661: Flags [P.], seq 1940:1968, ack 1, win 501, length 28
18:27:49.817187 IP 165.227.37.161.22 > 198.96.84.204.16661: Flags [P.], seq 1968:2108, ack 1, win 501, length 140
18:27:49.817285 IP 165.227.37.161.22 > 198.96.84.204.16661: Flags [P.], seq 2108:2136, ack 1, win 501, length 28
18:27:49.817414 IP 165.227.37.161.22 > 198.96.84.204.16661: Flags [P.], seq 2136:2260, ack 1, win 501, length 124
18:27:49.817496 IP 165.227.37.161.22 > 198.96.84.204.16661: Flags [P.], seq 2260:2288, ack 1, win 501, length 28
18:27:49.817688 IP 165.227.37.161.22 > 198.96.84.204.16661: Flags [P.], seq 2288:2428, ack 1, win 501, length 140
18:27:49.817922 IP 165.227.37.161.22 > 198.96.84.204.16661: Flags [P.], seq 2456:2596, ack 1, win 501, length 140
18:27:49.818157 IP 165.227.37.161.22 > 198.96.84.204.16661: Flags [P.], seq 2624:2764, ack 1, win 501, length 140
18:27:49.819138 IP 198.96.84.204.16661 > 165.227.37.161.22: Flags [.], ack 780, win 509, length 0
18:27:49.819171 IP 165.227.37.161.22 > 198.96.84.204.16661: Flags [P.], seq 2764:3800, ack 1, win 501, length 1036
18:27:49.819312 IP 165.227.37.161.22 > 198.96.84.204.16661: Flags [P.], seq 3800:3924, ack 1, win 501, length 124
18:27:49.819391 IP 165.227.37.161.22 > 198.96.84.204.16661: Flags [P.], seq 3924:3952, ack 1, win 501, length 28
18:27:49.819486 IP 165.227.37.161.22 > 198.96.84.204.16661: Flags [P.], seq 3952:4092, ack 1, win 501, length 140
18:27:49.819557 IP 165.227.37.161.22 > 198.96.84.204.16661: Flags [P.], seq 4092:4120, ack 1, win 501, length 28
18:27:49.819673 IP 165.227.37.161.22 > 198.96.84.204.16661: Flags [P.], seq 4120:4260, ack 1, win 501, length 140
18:27:49.819747 IP 165.227.37.161.22 > 198.96.84.204.16661: Flags [P.], seq 4260:4288, ack 1, win 501, length 28
18:27:49.819841 IP 165.227.37.161.22 > 198.96.84.204.16661: Flags [P.], seq 4288:4428, ack 1, win 501, length 140
18:27:49.820921 IP 198.96.84.204.16661 > 165.227.37.161.22: Flags [.], ack 2136, win 512, length 0
18:27:49.820954 IP 165.227.37.161.22 > 198.96.84.204.16661: Flags [P.], seq 4428:5296, ack 1, win 501, length 868
18:27:49.821066 IP 198.96.84.204.16661 > 165.227.37.161.22: Flags [.], ack 2260, win 512, length 0
18:27:49.821137 IP 165.227.37.161.22 > 198.96.84.204.16661: Flags [P.], seq 5296:5420, ack 1, win 501, length 124
18:27:49.821760 IP 165.227.37.161.22 > 198.96.84.204.16661: Flags [P.], seq 5420:5448, ack 1, win 501, length 28
18:27:49.821882 IP 165.227.37.161.22 > 198.96.84.204.16661: Flags [P.], seq 5448:5588, ack 1, win 501, length 140
18:27:49.821934 IP 198.96.84.204.16661 > 165.227.37.161.22: Flags [.], ack 2764, win 510, length 0
18:27:49.822025 IP 165.227.37.161.22 > 198.96.84.204.16661: Flags [P.], seq 5588:5616, ack 1, win 501, length 28
18:27:49.822108 IP 198.96.84.204.16661 > 165.227.37.161.22: Flags [.], ack 4092, win 512, length 0
18:27:49.822383 IP 165.227.37.161.22 > 198.96.84.204.16661: Flags [P.], seq 5740:6120, ack 1, win 501, length 380
18:27:49.822573 IP 165.227.37.161.22 > 198.96.84.204.16661: Flags [P.], seq 6120:6580, ack 1, win 501, length 460
18:27:49.822682 IP 198.96.84.204.16661 > 165.227.37.161.22: Flags [.], ack 4428, win 511, length 0
18:27:49.822810 IP 165.227.37.161.22 > 198.96.84.204.16661: Flags [P.], seq 6580:6832, ack 1, win 501, length 252
18:27:49.822959 IP 165.227.37.161.22 > 198.96.84.204.16661: Flags [P.], seq 6832:6988, ack 1, win 501, length 156
18:27:49.823071 IP 165.227.37.161.22 > 198.96.84.204.16661: Flags [P.], seq 6988:7144, ack 1, win 501, length 156
18:27:49.823177 IP 165.227.37.161.22 > 198.96.84.204.16661: Flags [P.], seq 7144:7300, ack 1, win 501, length 156
18:27:49.823281 IP 165.227.37.161.22 > 198.96.84.204.16661: Flags [P.], seq 7300:7456, ack 1, win 501, length 156
18:27:49.823414 IP 165.227.37.161.22 > 198.96.84.204.16661: Flags [P.], seq 7456:7612, ack 1, win 501, length 156
18:27:49.823545 IP 165.227.37.161.22 > 198.96.84.204.16661: Flags [P.], seq 7612:7768, ack 1, win 501, length 156
18:27:49.823670 IP 165.227.37.161.22 > 198.96.84.204.16661: Flags [P.], seq 7768:7924, ack 1, win 501, length 156
18:27:49.823739 IP 198.96.84.204.16661 > 165.227.37.161.22: Flags [.], ack 5420, win 512, length 0
18:27:49.823920 IP 165.227.37.161.22 > 198.96.84.204.16661: Flags [P.], seq 7924:8176, ack 1, win 501, length 252
18:27:49.824042 IP 165.227.37.161.22 > 198.96.84.204.16661: Flags [P.], seq 8176:8332, ack 1, win 501, length 156
18:27:49.824148 IP 165.227.37.161.22 > 198.96.84.204.16661: Flags [P.], seq 8332:8488, ack 1, win 501, length 156
18:27:49.824253 IP 165.227.37.161.22 > 198.96.84.204.16661: Flags [P.], seq 8488:8644, ack 1, win 501, length 156
18:27:49.824432 IP 165.227.37.161.22 > 198.96.84.204.16661: Flags [P.], seq 8644:8800, ack 1, win 501, length 156
18:27:49.824594 IP 165.227.37.161.22 > 198.96.84.204.16661: Flags [P.], seq 8800:8956, ack 1, win 501, length 156
18:27:49.824709 IP 165.227.37.161.22 > 198.96.84.204.16661: Flags [P.], seq 8956:9112, ack 1, win 501, length 156
18:27:49.824816 IP 165.227.37.161.22 > 198.96.84.204.16661: Flags [P.], seq 9112:9268, ack 1, win 501, length 156
18:27:49.824923 IP 165.227.37.161.22 > 198.96.84.204.16661: Flags [P.], seq 9268:9424, ack 1, win 501, length 156
18:27:49.825030 IP 165.227.37.161.22 > 198.96.84.204.16661: Flags [P.], seq 9424:9580, ack 1, win 501, length 156
18:27:49.825134 IP 165.227.37.161.22 > 198.96.84.204.16661: Flags [P.], seq 9580:9736, ack 1, win 501, length 156
18:27:49.825264 IP 198.96.84.204.16661 > 165.227.37.161.22: Flags [.], ack 5740, win 511, length 0
18:27:49.825286 IP 198.96.84.204.16661 > 165.227.37.161.22: Flags [.], ack 6580, win 508, length 0
18:27:49.825480 IP 165.227.37.161.22 > 198.96.84.204.16661: Flags [P.], seq 9736:10084, ack 1, win 501, length 348
18:27:49.825674 IP 165.227.37.161.22 > 198.96.84.204.16661: Flags [P.], seq 10084:10240, ack 1, win 501, length 156
18:27:49.825785 IP 165.227.37.161.22 > 198.96.84.204.16661: Flags [P.], seq 10240:10396, ack 1, win 501, length 156
18:27:49.825893 IP 165.227.37.161.22 > 198.96.84.204.16661: Flags [P.], seq 10396:10552, ack 1, win 501, length 156
18:27:49.826002 IP 165.227.37.161.22 > 198.96.84.204.16661: Flags [P.], seq 10552:10708, ack 1, win 501, length 156
18:27:49.826111 IP 165.227.37.161.22 > 198.96.84.204.16661: Flags [P.], seq 10708:10864, ack 1, win 501, length 156
18:27:49.826217 IP 165.227.37.161.22 > 198.96.84.204.16661: Flags [P.], seq 10864:11020, ack 1, win 501, length 156
18:27:49.826325 IP 165.227.37.161.22 > 198.96.84.204.16661: Flags [P.], seq 11020:11176, ack 1, win 501, length 156
18:27:49.826561 IP 165.227.37.161.22 > 198.96.84.204.16661: Flags [P.], seq 11176:11332, ack 1, win 501, length 156
18:27:49.826687 IP 165.227.37.161.22 > 198.96.84.204.16661: Flags [P.], seq 11332:11488, ack 1, win 501, length 156
18:27:49.826801 IP 165.227.37.161.22 > 198.96.84.204.16661: Flags [P.], seq 11488:11644, ack 1, win 501, length 156
18:27:49.826905 IP 165.227.37.161.22 > 198.96.84.204.16661: Flags [P.], seq 11644:11800, ack 1, win 501, length 156
18:27:49.826973 IP 198.96.84.204.16661 > 165.227.37.161.22: Flags [.], ack 6988, win 512, length 0
18:27:49.826984 IP 198.96.84.204.16661 > 165.227.37.161.22: Flags [.], ack 7300, win 511, length 0
18:27:49.826988 IP 198.96.84.204.16661 > 165.227.37.161.22: Flags [.], ack 7924, win 509, length 0
18:27:49.826992 IP 198.96.84.204.16661 > 165.227.37.161.22: Flags [.], ack 8332, win 512, length 0
18:27:49.826996 IP 198.96.84.204.16661 > 165.227.37.161.22: Flags [.], ack 8644, win 511, length 0
18:27:49.827207 IP 165.227.37.161.22 > 198.96.84.204.16661: Flags [P.], seq 11800:12452, ack 1, win 501, length 652
18:27:49.827330 IP 165.227.37.161.22 > 198.96.84.204.16661: Flags [P.], seq 12452:12608, ack 1, win 501, length 156
18:27:49.827450 IP 165.227.37.161.22 > 198.96.84.204.16661: Flags [P.], seq 12608:12764, ack 1, win 501, length 156
18:27:49.827608 IP 165.227.37.161.22 > 198.96.84.204.16661: Flags [P.], seq 12764:12920, ack 1, win 501, length 156
18:27:49.827734 IP 165.227.37.161.22 > 198.96.84.204.16661: Flags [P.], seq 12920:13076, ack 1, win 501, length 156
18:27:49.827850 IP 165.227.37.161.22 > 198.96.84.204.16661: Flags [P.], seq 13076:13232, ack 1, win 501, length 156
18:27:49.827968 IP 165.227.37.161.22 > 198.96.84.204.16661: Flags [P.], seq 13232:13388, ack 1, win 501, length 156
18:27:49.828074 IP 165.227.37.161.22 > 198.96.84.204.16661: Flags [P.], seq 13388:13544, ack 1, win 501, length 156
18:27:49.828183 IP 165.227.37.161.22 > 198.96.84.204.16661: Flags [P.], seq 13544:13700, ack 1, win 501, length 156
18:27:49.828292 IP 165.227.37.161.22 > 198.96.84.204.16661: Flags [P.], seq 13700:13856, ack 1, win 501, length 156
18:27:49.828418 IP 198.96.84.204.16661 > 165.227.37.161.22: Flags [.], ack 10084, win 512, length 0
18:27:49.828537 IP 198.96.84.204.16661 > 165.227.37.161.22: Flags [.], ack 10864, win 509, length 0
18:27:49.828556 IP 198.96.84.204.16661 > 165.227.37.161.22: Flags [.], ack 11332, win 508, length 0
18:27:49.828686 IP 165.227.37.161.22 > 198.96.84.204.16661: Flags [P.], seq 13856:14316, ack 1, win 501, length 460
18:27:49.828819 IP 165.227.37.161.22 > 198.96.84.204.16661: Flags [P.], seq 14316:14472, ack 1, win 501, length 156
18:27:49.828932 IP 165.227.37.161.22 > 198.96.84.204.16661: Flags [P.], seq 14472:14628, ack 1, win 501, length 156
18:27:49.829035 IP 165.227.37.161.22 > 198.96.84.204.16661: Flags [P.], seq 14628:14784, ack 1, win 501, length 156
18:27:49.829144 IP 165.227.37.161.22 > 198.96.84.204.16661: Flags [P.], seq 14784:14940, ack 1, win 501, length 156
18:27:49.829247 IP 165.227.37.161.22 > 198.96.84.204.16661: Flags [P.], seq 14940:15096, ack 1, win 501, length 156
18:27:49.829375 IP 165.227.37.161.22 > 198.96.84.204.16661: Flags [P.], seq 15096:15252, ack 1, win 501, length 156
18:27:49.829517 IP 165.227.37.161.22 > 198.96.84.204.16661: Flags [P.], seq 15252:15408, ack 1, win 501, length 156
18:27:49.829691 IP 165.227.37.161.22 > 198.96.84.204.16661: Flags [P.], seq 15408:15564, ack 1, win 501, length 156
18:27:49.829802 IP 165.227.37.161.22 > 198.96.84.204.16661: Flags [P.], seq 15564:15720, ack 1, win 501, length 156
18:27:49.829905 IP 165.227.37.161.22 > 198.96.84.204.16661: Flags [P.], seq 15720:15876, ack 1, win 501, length 156
18:27:49.830006 IP 165.227.37.161.22 > 198.96.84.204.16661: Flags [P.], seq 15876:16032, ack 1, win 501, length 156
18:27:49.830137 IP 198.96.84.204.16661 > 165.227.37.161.22: Flags [.], ack 11644, win 512, length 0
18:27:49.830158 IP 198.96.84.204.16661 > 165.227.37.161.22: Flags [.], ack 12764, win 508, length 0
18:27:49.830262 IP 165.227.37.161.22 > 198.96.84.204.16661: Flags [P.], seq 16032:16188, ack 1, win 501, length 156
18:27:49.830364 IP 165.227.37.161.22 > 198.96.84.204.16661: Flags [P.], seq 16188:16424, ack 1, win 501, length 236
18:27:49.830483 IP 165.227.37.161.22 > 198.96.84.204.16661: Flags [P.], seq 16424:16580, ack 1, win 501, length 156
18:27:49.830637 IP 165.227.37.161.22 > 198.96.84.204.16661: Flags [P.], seq 16580:16736, ack 1, win 501, length 156
18:27:49.830740 IP 165.227.37.161.22 > 198.96.84.204.16661: Flags [P.], seq 16736:16892, ack 1, win 501, length 156
18:27:49.830834 IP 165.227.37.161.22 > 198.96.84.204.16661: Flags [P.], seq 16892:17048, ack 1, win 501, length 156
18:27:49.830940 IP 165.227.37.161.22 > 198.96.84.204.16661: Flags [P.], seq 17048:17204, ack 1, win 501, length 156
18:27:49.831035 IP 165.227.37.161.22 > 198.96.84.204.16661: Flags [P.], seq 17204:17360, ack 1, win 501, length 156
18:27:49.831127 IP 165.227.37.161.22 > 198.96.84.204.16661: Flags [P.], seq 17360:17516, ack 1, win 501, length 156
18:27:49.831219 IP 165.227.37.161.22 > 198.96.84.204.16661: Flags [P.], seq 17516:17672, ack 1, win 501, length 156
18:27:49.831309 IP 165.227.37.161.22 > 198.96.84.204.16661: Flags [P.], seq 17672:17828, ack 1, win 501, length 156
18:27:49.831399 IP 165.227.37.161.22 > 198.96.84.204.16661: Flags [P.], seq 17828:17984, ack 1, win 501, length 156
18:27:49.831502 IP 165.227.37.161.22 > 198.96.84.204.16661: Flags [P.], seq 17984:18140, ack 1, win 501, length 156
18:27:49.831793 IP 198.96.84.204.16661 > 165.227.37.161.22: Flags [.], ack 13700, win 512, length 0
18:27:49.831825 IP 165.227.37.161.22 > 198.96.84.204.16661: Flags [P.], seq 18140:18452, ack 1, win 501, length 312
18:27:49.831980 IP 165.227.37.161.22 > 198.96.84.204.16661: Flags [P.], seq 18452:18704, ack 1, win 501, length 252
18:27:49.832090 IP 165.227.37.161.22 > 198.96.84.204.16661: Flags [P.], seq 18704:18860, ack 1, win 501, length 156
18:27:49.832192 IP 165.227.37.161.22 > 198.96.84.204.16661: Flags [P.], seq 18860:19016, ack 1, win 501, length 156
18:27:49.832293 IP 165.227.37.161.22 > 198.96.84.204.16661: Flags [P.], seq 19016:19172, ack 1, win 501, length 156
18:27:49.832393 IP 165.227.37.161.22 > 198.96.84.204.16661: Flags [P.], seq 19172:19328, ack 1, win 501, length 156
18:27:49.833204 IP 198.96.84.204.16661 > 165.227.37.161.22: Flags [.], ack 14472, win 509, length 0
18:27:49.833234 IP 165.227.37.161.22 > 198.96.84.204.16661: Flags [P.], seq 19328:19484, ack 1, win 501, length 156
18:27:49.833370 IP 198.96.84.204.16661 > 165.227.37.161.22: Flags [.], ack 15096, win 512, length 0
18:27:49.833494 IP 165.227.37.161.22 > 198.96.84.204.16661: Flags [P.], seq 19484:19832, ack 1, win 501, length 348
18:27:49.833648 IP 165.227.37.161.22 > 198.96.84.204.16661: Flags [P.], seq 19832:19988, ack 1, win 501, length 156
18:27:49.833761 IP 165.227.37.161.22 > 198.96.84.204.16661: Flags [P.], seq 19988:20144, ack 1, win 501, length 156
18:27:49.833870 IP 165.227.37.161.22 > 198.96.84.204.16661: Flags [P.], seq 20144:20300, ack 1, win 501, length 156
18:27:49.833986 IP 165.227.37.161.22 > 198.96.84.204.16661: Flags [P.], seq 20300:20456, ack 1, win 501, length 156
18:27:49.834095 IP 165.227.37.161.22 > 198.96.84.204.16661: Flags [P.], seq 20456:20612, ack 1, win 501, length 156
18:27:49.834417 IP 198.96.84.204.16661 > 165.227.37.161.22: Flags [.], ack 15876, win 509, length 0
18:27:49.834471 IP 165.227.37.161.22 > 198.96.84.204.16661: Flags [P.], seq 20612:20768, ack 1, win 501, length 156
18:27:49.834507 IP 198.96.84.204.16661 > 165.227.37.161.22: Flags [.], ack 16892, win 512, length 0
18:27:49.834523 IP 198.96.84.204.16661 > 165.227.37.161.22: Flags [.], ack 17204, win 511, length 0
18:27:49.834779 IP 165.227.37.161.22 > 198.96.84.204.16661: Flags [P.], seq 20768:21228, ack 1, win 501, length 460
18:27:49.834912 IP 165.227.37.161.22 > 198.96.84.204.16661: Flags [P.], seq 21228:21384, ack 1, win 501, length 156
18:27:49.835029 IP 165.227.37.161.22 > 198.96.84.204.16661: Flags [P.], seq 21384:21540, ack 1, win 501, length 156
18:27:49.835141 IP 165.227.37.161.22 > 198.96.84.204.16661: Flags [P.], seq 21540:21696, ack 1, win 501, length 156
18:27:49.835252 IP 165.227.37.161.22 > 198.96.84.204.16661: Flags [P.], seq 21696:21852, ack 1, win 501, length 156
18:27:49.835399 IP 165.227.37.161.22 > 198.96.84.204.16661: Flags [P.], seq 21852:22008, ack 1, win 501, length 156
18:27:49.835580 IP 198.96.84.204.16661 > 165.227.37.161.22: Flags [.], ack 17672, win 509, length 0
18:27:49.835594 IP 198.96.84.204.16661 > 165.227.37.161.22: Flags [.], ack 17984, win 508, length 0
18:27:49.835601 IP 165.227.37.161.22 > 198.96.84.204.16661: Flags [P.], seq 22008:22164, ack 1, win 501, length 156
18:27:49.835770 IP 165.227.37.161.22 > 198.96.84.204.16661: Flags [P.], seq 22164:22512, ack 1, win 501, length 348
18:27:49.835881 IP 165.227.37.161.22 > 198.96.84.204.16661: Flags [P.], seq 22512:22668, ack 1, win 501, length 156
18:27:49.835984 IP 165.227.37.161.22 > 198.96.84.204.16661: Flags [P.], seq 22668:22824, ack 1, win 501, length 156
18:27:49.836086 IP 165.227.37.161.22 > 198.96.84.204.16661: Flags [P.], seq 22824:22980, ack 1, win 501, length 156
18:27:49.836224 IP 165.227.37.161.22 > 198.96.84.204.16661: Flags [P.], seq 22980:23136, ack 1, win 501, length 156
18:27:49.836408 IP 165.227.37.161.22 > 198.96.84.204.16661: Flags [P.], seq 23136:23292, ack 1, win 501, length 156
18:27:49.836598 IP 165.227.37.161.22 > 198.96.84.204.16661: Flags [P.], seq 23292:23448, ack 1, win 501, length 156
18:27:49.836741 IP 165.227.37.161.22 > 198.96.84.204.16661: Flags [P.], seq 23448:23604, ack 1, win 501, length 156
18:27:49.836849 IP 165.227.37.161.22 > 198.96.84.204.16661: Flags [P.], seq 23604:23760, ack 1, win 501, length 156
18:27:49.836951 IP 165.227.37.161.22 > 198.96.84.204.16661: Flags [P.], seq 23760:23916, ack 1, win 501, length 156
18:27:51.337945 IP 198.96.84.204.16661 > 165.227.37.161.22: Flags [.], ack 1066684, win 32, length 0
18:27:51.338130 IP 165.227.37.161.22 > 198.96.84.204.16661: Flags [P.], seq 1068696:1068948, ack 309, win 501, length 252
18:27:51.338326 IP 165.227.37.161.22 > 198.96.84.204.16661: Flags [P.], seq 1068948:1069104, ack 309, win 501, length 156
18:27:51.338517 IP 165.227.37.161.22 > 198.96.84.204.16661: Flags [P.], seq 1069104:1069260, ack 309, win 501, length 156
18:27:51.338702 IP 165.227.37.161.22 > 198.96.84.204.16661: Flags [P.], seq 1069260:1069416, ack 309, win 501, length 156
18:27:51.338893 IP 165.227.37.161.22 > 198.96.84.204.16661: Flags [P.], seq 1069416:1069572, ack 309, win 501, length 156
18:27:51.338955 IP 198.96.84.204.16661 > 165.227.37.161.22: Flags [.], ack 1067864, win 28, length 0
18:27:51.339157 IP 198.96.84.204.16661 > 165.227.37.161.22: Flags [.], ack 1068020, win 27, length 0
18:27:51.339187 IP 198.96.84.204.16661 > 165.227.37.161.22: Flags [.], ack 1068412, win 25, length 0
18:27:51.339414 IP 165.227.37.161.22 > 198.96.84.204.16661: Flags [P.], seq 1069572:1070032, ack 309, win 501, length 460
18:27:51.339604 IP 165.227.37.161.22 > 198.96.84.204.16661: Flags [P.], seq 1070032:1070188, ack 309, win 501, length 156
18:27:51.339825 IP 165.227.37.161.22 > 198.96.84.204.16661: Flags [P.], seq 1070188:1070344, ack 309, win 501, length 156
18:27:51.339945 IP 198.96.84.204.16661 > 165.227.37.161.22: Flags [.], ack 1068948, win 23, length 0
18:27:51.340146 IP 165.227.37.161.22 > 198.96.84.204.16661: Flags [P.], seq 1070344:1070596, ack 309, win 501, length 252
18:27:51.340338 IP 165.227.37.161.22 > 198.96.84.204.16661: Flags [P.], seq 1070596:1070752, ack 309, win 501, length 156
18:27:51.340489 IP 198.96.84.204.16661 > 165.227.37.161.22: Flags [.], ack 1069260, win 22, length 0
18:27:51.340631 IP 198.96.84.204.16661 > 165.227.37.161.22: Flags [.], ack 1069572, win 21, length 0
18:27:51.340691 IP 165.227.37.161.22 > 198.96.84.204.16661: Flags [P.], seq 1070752:1071004, ack 309, win 501, length 252
18:27:51.340929 IP 165.227.37.161.22 > 198.96.84.204.16661: Flags [P.], seq 1071004:1071256, ack 309, win 501, length 252
18:27:51.341130 IP 165.227.37.161.22 > 198.96.84.204.16661: Flags [P.], seq 1071256:1071412, ack 309, win 501, length 156
18:27:51.341341 IP 165.227.37.161.22 > 198.96.84.204.16661: Flags [P.], seq 1071412:1071568, ack 309, win 501, length 156
18:27:51.341575 IP 165.227.37.161.22 > 198.96.84.204.16661: Flags [P.], seq 1071568:1071724, ack 309, win 501, length 156
18:27:51.341782 IP 165.227.37.161.22 > 198.96.84.204.16661: Flags [P.], seq 1071724:1071880, ack 309, win 501, length 156
18:27:51.341832 IP 198.96.84.204.16661 > 165.227.37.161.22: Flags [.], ack 1070596, win 17, length 0
18:27:51.342067 IP 165.227.37.161.22 > 198.96.84.204.16661: Flags [P.], seq 1071880:1072132, ack 309, win 501, length 252
18:27:51.342259 IP 165.227.37.161.22 > 198.96.84.204.16661: Flags [P.], seq 1072132:1072288, ack 309, win 501, length 156
18:27:51.342448 IP 165.227.37.161.22 > 198.96.84.204.16661: Flags [P.], seq 1072288:1072444, ack 309, win 501, length 156
18:27:51.342669 IP 198.96.84.204.16661 > 165.227.37.161.22: Flags [P.], seq 309:365, ack 1070752, win 16, length 56
18:27:51.342699 IP 165.227.37.161.22 > 198.96.84.204.16661: Flags [P.], seq 1072444:1072600, ack 309, win 501, length 156
18:27:51.342856 IP 198.96.84.204.16661 > 165.227.37.161.22: Flags [.], ack 1071412, win 14, length 0
^C
7427 packets captured
7467 packets received by filter
40 packets dropped by kernel
